2FA Code is required,Le code 2FA est requis,
Mpesa Setup not set up in Payment Gateway,La configuration Mpesa n'est pas définie dans la passerelle de paiement,
Multiple filesystems found on volume. Can't shrink,Plusieurs systèmes de fichiers trouvés sur le volume. Impossible de réduire,
Multiple volumes found. Please select the volume to shrink.,Plusieurs volumes trouvés. Veuillez sélectionner le volume à réduire.,
NAT Iptables can only be installed on servers without public IP,NAT Iptables ne peut être installé que sur des serveurs sans IP publique,
NAT Iptables requires a NAT server to be set,NAT Iptables nécessite qu'un serveur NAT soit configuré,
NAT Servers are only supported on AWS EC2 and Frappe Compute,Les serveurs NAT ne sont pris en charge que sur AWS EC2 et Frappe Compute,
"Name not found, API access not permitted","Nom introuvable, accès API non autorisé",
Names cannot contain invalid characters,Les noms ne peuvent pas contenir de caractères invalides,
Need all required dependencies,Toutes les dépendances requises sont nécessaires,
New Worker Allocation,Nouvelle allocation de workers,
No Active Team record found.,Aucun enregistrement d'équipe active trouvé.,
No CIDR block available,Aucun bloc CIDR disponible,
No VNIC found for this OCI instance.,Aucun VNIC trouvé pour cette instance OCI.,
No active benches found!,Aucun bench actif trouvé !,
No additional system user created for this site.,Aucun utilisateur système supplémentaire créé pour ce site.,
No additional volumes found. Cannot shrink any volume.,Aucun volume supplémentaire trouvé. Impossible de réduire un volume.,
No approval request exists for the given app release,Aucune demande d'approbation n'existe pour cette version d'application,
No asset file uploaded,Aucun fichier d'asset téléchargé,
No build present for this release group,Aucun build présent pour ce groupe de versions,
No card added. Please add a card to your account.,Aucune carte ajoutée. Veuillez ajouter une carte à votre compte.,
No database server found for this server,Aucun serveur de base de données trouvé pour ce serveur,
No device name available for new volume,Aucun nom de périphérique disponible pour le nouveau volume,
No down benches found for this server,Aucun bench hors service trouvé pour ce serveur,
No image available for Ubuntu 22.04,Aucune image disponible pour Ubuntu 22.04,
No of Binlogs are invalid,Le nombre de binlogs est invalide,
No pending restoration found,Aucune restauration en attente trouvée,
No public IP associated with this instance.,Aucune IP publique associée à cette instance.,
No pyproject found or something went wrong with github,Aucun pyproject trouvé ou un problème est survenu avec GitHub,
No registered account with this email address,Aucun compte enregistré avec cette adresse e-mail,
No release group found for the selected apps,Aucun groupe de versions trouvé pour les applications sélectionnées,
No release group found!,Aucun groupe de versions trouvé !,
No releases found for this Marketplace App's sources,Aucune version trouvée pour les sources de cette application Marketplace,
No running job found!,Aucune tâche en cours trouvée !,
No secondary private IP assigned to this instance.,Aucune IP privée secondaire attribuée à cette instance.,
No servers found for new benches!,Aucun serveur trouvé pour les nouveaux benches !,
No servers found to split updates,Aucun serveur trouvé pour répartir les mises à jour,
No sources found for this Marketplace App,Aucune source trouvée pour cette application Marketplace,
No stable version found for the selected app(s),Aucune version stable trouvée pour la ou les applications sélectionnées,
Non-chargeable snapshots cannot be locked,Les snapshots non facturables ne peuvent pas être verrouillés,
Not Permitted,Non autorisé,
Not permitted,Non autorisé,
Not permitted to access this job,Non autorisé à accéder à cette tâche,
Not permitted to access this play,Non autorisé à accéder à ce play,
Not permitted to access this server,Non autorisé à accéder à ce serveur,
OTP has expired. Please try again.,L'OTP a expiré. Veuillez réessayer.,
OTP is expired. Please re-send and try again,L'OTP a expiré. Veuillez le renvoyer et réessayer,
OTP is not set. Please set OTP and try.,L'OTP n'est pas défini. Veuillez le définir et réessayer.,
Offsite Backups aren't setup yet,Les sauvegardes hors site ne sont pas encore configurées,
On-Prem Failover is not configured for this server.,Le basculement sur site n'est pas configuré pour ce serveur.,
On-Prem Failover support is not enabled for this server.,Le support de basculement sur site n'est pas activé pour ce serveur.,
One of `site` or `server` is required,L'un des champs `site` ou `server` est requis,
Ongoing Agent Job for site exists,Une tâche Agent en cours existe pour ce site,
Only AWS Provider is supported for now,Seul le fournisseur AWS est pris en charge pour le moment,
Only AWS and Hetzner Providers support snapshot locking/unlocking,Seuls les fournisseurs AWS et Hetzner prennent en charge le verrouillage/déverrouillage des snapshots,
Only AWS hosted server is supported currently.,Seul un serveur hébergé sur AWS est pris en charge actuellement.,
Only Active Partner team can add new leads.,Seule une équipe partenaire active peut ajouter de nouveaux prospects.,
Only Active Partner team can apply for certificates.,Seule une équipe partenaire active peut demander des certificats.,
Only Partner team can transfer credits.,Seule une équipe partenaire peut transférer des crédits.,
Only SaaS sites are allowed to login to Frappe Cloud via current method.,Seuls les sites SaaS sont autorisés à se connecter à Frappe Cloud via cette méthode.,
Only Scheduled actions can be cancelled.,Seules les actions planifiées peuvent être annulées.,
Only enabled and public app sources will reflect here!,Seules les sources d'applications activées et publiques apparaîtront ici !,
Only one storage add-on plan can be enabled at a time,Un seul forfait complémentaire de stockage peut être activé à la fois,
Only one value can be set for MariaDB system variable,Une seule valeur peut être définie pour une variable système MariaDB,
Only system users can access partner teams.,Seuls les utilisateurs système peuvent accéder aux équipes partenaires.,
Only team admin can perform this action.,Seul l'administrateur de l'équipe peut effectuer cette action.,
Only team member can perform this action.,Seul un membre de l'équipe peut effectuer cette action.,
Only team owner can disable the account,Seul le propriétaire de l'équipe peut désactiver le compte,
Only team owner can enable the account,Seul le propriétaire de l'équipe peut activer le compte,
Only team owner can perform this action.,Seul le propriétaire de l'équipe peut effectuer cette action.,
Only team owner or admins can invite team members,Seul le propriétaire ou les administrateurs de l'équipe peuvent inviter des membres,
Only the team owner or admin can create role permissions,Seul le propriétaire ou l'administrateur de l'équipe peut créer des permissions de rôle,
Only the team owner or admin can delete this role permission,Seul le propriétaire ou l'administrateur de l'équipe peut supprimer cette permission de rôle,
Only virtual machines of series 'nat' can create NAT servers,Seules les machines virtuelles de la série 'nat' peuvent créer des serveurs NAT,
Only virtual machines of series 'u' can create unified servers.,Seules les machines virtuelles de la série 'u' peuvent créer des serveurs unifiés.,
Only workflows in Failure state can be retried.,Seuls les workflows en état d'échec peuvent être relancés.,
"Parenttype, Parent and Parentfield are required to insert a child record","Le Parenttype, le Parent et le Parentfield sont requis pour insérer un enregistrement enfant",
Partner Details not found,Détails du partenaire introuvables,
Partner not found on frappe.io,Partenaire introuvable sur frappe.io,
Payment Gateway,Passerelle de paiement,
Payment Gateway not found,Passerelle de paiement introuvable,
Payment Partner,Partenaire de paiement,
Payments,Paiements,
Pending requests cannot have access expiry,Les demandes en attente ne peuvent pas avoir de date d'expiration d'accès,
Percent of disk space  must be between 10 and 90,Le pourcentage d'espace disque doit être compris entre 10 et 90,
Phone Call is available only for 'Incident',L'appel téléphonique n'est disponible que pour les incidents,
Physical Backup Restoration is still in progress,La restauration de la sauvegarde physique est toujours en cours,
Physical and offsite logical backups cannot be taken together,Les sauvegardes physiques et logiques hors site ne peuvent pas être effectuées simultanément,
Physical backup is disabled system wide. Please try again later.,La sauvegarde physique est désactivée à l'échelle du système. Veuillez réessayer plus tard.,
Physical backup is not enabled for this site. Please reach out to support.,La sauvegarde physique n'est pas activée pour ce site. Veuillez contacter le support.,
Physical backups cannot be forcefully triggered,Les sauvegardes physiques ne peuvent pas être déclenchées de force,
Physical backups cannot be taken with files,Les sauvegardes physiques ne peuvent pas être effectuées avec des fichiers,
"Plan is already in use, cannot update the plan. Please contact support to proceed.","Le forfait est déjà utilisé, impossible de le mettre à jour. Veuillez contacter le support pour continuer.",
Plan title is required,Le titre du forfait est requis,
Plan {0} does not exist,Le forfait {0} n'existe pas,
Please choose a different subdomain,Veuillez choisir un sous-domaine différent,
Please choose at least one site to recover.,Veuillez choisir au moins un site à récupérer.,
Please complete pre-migration steps before migrating,Veuillez compléter les étapes de pré-migration avant de migrer,
Please configure Wazuh Server in Press Settings,Veuillez configurer le serveur Wazuh dans les paramètres Press,
Please don't append http/https to the repo url,Veuillez ne pas ajouter http/https à l'URL du dépôt,
Please ensure that the attached text is a valid public key,Veuillez vous assurer que le texte joint est une clé publique valide,
Please make sure that a valid public key has been added in team doc.,Veuillez vous assurer qu'une clé publique valide a été ajoutée dans le document de l'équipe.,
Please provide a valid country name,Veuillez fournir un nom de pays valide,
Please provide a valid secret key.,Veuillez fournir une clé secrète valide.,
Please re-login to verify your identity.,Veuillez vous reconnecter pour vérifier votre identité.,
Please remove all auto scale triggers before dropping the secondary server,Veuillez supprimer tous les déclencheurs d'auto scale avant de supprimer le serveur secondaire,
Please select Managed Database Service,Veuillez sélectionner le service de base de données gérée,
Please select a <b>Build Server</b>.,Veuillez sélectionner un <b>serveur de build</b>.,
Please select at least one server type,Veuillez sélectionner au moins un type de serveur,
Please set a SSH key to generate certificate,Veuillez définir une clé SSH pour générer le certificat,
Please sign up first,Veuillez d'abord vous inscrire,
Please wait for 30 seconds before requesting a new OTP,Veuillez patienter 30 secondes avant de demander un nouveau OTP,
Please wait for 30 seconds before sending the OTP again,Veuillez patienter 30 secondes avant de renvoyer l'OTP,
Please wait for the snapshot to be completed.,Veuillez attendre que le snapshot soit terminé.,
Posting Date,Date de comptabilisation,
Press,Press,
PressWorkflowTest doctype can be used only in Unit Tests,Le doctype PressWorkflowTest ne peut être utilisé que dans les tests unitaires,
Primary Private IP not found.,IP privée principale introuvable.,
Primary domain can't be redirected.,Le domaine principal ne peut pas être redirigé.,
Primary server must have a secondary server to auto scale,Le serveur principal doit avoir un serveur secondaire pour l'auto scale,
Private Key and Certificate do not match,La clé privée et le certificat ne correspondent pas,
Progress,Progression,
Provide a path to store the physical backup,Fournissez un chemin pour stocker la sauvegarde physique,
Provided site backup is not available.,La sauvegarde du site fournie n'est pas disponible.,
Provided site backup is not physical backup.,La sauvegarde du site fournie n'est pas une sauvegarde physique.,
Provisioning a database replica is only applicable for Database Servers.,Le provisionnement d'un réplica de base de données est applicable uniquement aux serveurs de base de données.,
Public IP for MariaDB not found,IP publique pour MariaDB introuvable,
Pyproject not found at this commit,Pyproject introuvable pour ce commit,
Python Version,Version Python,
Query,Requête,
Ram Assigned for Workers (GB),RAM assignée aux workers (Go),
Razorpay Payment Creation Failed,Échec de la création du paiement local,
Razorpay payment gateway is not available. Please use Stripe or another supported gateway.,La passerelle de paiement locale n'est pas disponible. Veuillez utiliser Stripe ou une autre passerelle prise en charge.,
Redirection route after login should start with /,La route de redirection après connexion doit commencer par /,
Related Documents,Documents associés,
Release group app does not exist!,L'application du groupe de versions n'existe pas !,
Replica server is not available for this site,Le serveur réplica n'est pas disponible pour ce site,
Resource {0} does not belong to {1},La ressource {0} n'appartient pas à {1},
Resources must belong to the same team,Les ressources doivent appartenir à la même équipe,
Retry limit exceeded. Please check the error and try again.,Limite de tentatives dépassée. Veuillez vérifier l'erreur et réessayer.,
Role Permission already exists,La permission de rôle existe déjà,
Role with title {0} already exists in this team,Le rôle intitulé {0} existe déjà dans cette équipe,
Rollback commit hash is not valid,Le hash du commit de rollback n'est pas valide,
Rollback commit hash is required when rollback to specific commit is enabled,Le hash du commit de rollback est requis lorsque le retour à un commit spécifique est activé,
Rows Examined,Lignes examinées,
Rows Sent,Lignes envoyées,
SSH Certificate Authority is required to setup SSH Proxy,Une autorité de certification SSH est requise pour configurer le proxy SSH,
Sales Invoice created successfully on external site.,Facture de vente créée avec succès sur le site externe.,
Scale is already scheduled for this time,Le redimensionnement est déjà planifié pour cette heure,
Scheduled scales must be an hour apart,Les redimensionnements planifiés doivent être espacés d'au moins une heure,
Scheduled time must be in the future. Please provide a valid scheduled time.,L'heure planifiée doit être dans le futur. Veuillez fournir une heure planifiée valide.,
Secondary IP assignment is currently only supported for AWS EC2 instances,L'attribution d'IP secondaire n'est actuellement prise en charge que pour les instances AWS EC2,
Secondary IP assignment is only supported for NAT servers,L'attribution d'IP secondaire n'est prise en charge que pour les serveurs NAT,
Secondary IP detachment is currently only supported for AWS EC2 instances,Le détachement d'IP secondaire n'est actuellement pris en charge que pour les instances AWS EC2,
Secondary IP detachment is only supported for NAT servers,Le détachement d'IP secondaire n'est pris en charge que pour les serveurs NAT,
Selected plan is not a trial plan,Le forfait sélectionné n'est pas un forfait d'essai,
Selected plan is not for site,Le forfait sélectionné n'est pas pour un site,
Self Hosted Proxy Server Creation Error,Erreur de création du serveur proxy auto-hébergé,
Server,Serveur,
Server Creation Error,Erreur de création du serveur,
Server Snapshot Recovery is currently disabled. Please try again later.,La récupération par snapshot du serveur est actuellement désactivée. Veuillez réessayer plus tard.,
Server Type,Type de serveur,
Server is already scaled down,Le serveur est déjà réduit,
Server is already scaled up,Le serveur est déjà augmenté,
Server is not configured for auto scaling,Le serveur n'est pas configuré pour l'auto scaling,
Server is not reachable. Please try again later.,Le serveur est injoignable. Veuillez réessayer plus tard.,
Server must have a private IP to create Bench,Le serveur doit avoir une IP privée pour créer un bench,
Server not found in Frappe Cloud,Serveur introuvable dans Frappe Cloud,
Server verification failed. Please check the server details and try again.,La vérification du serveur a échoué. Veuillez vérifier les détails du serveur et réessayer.,
Server {0} has already been archived.,Le serveur {0} a déjà été archivé.,
Server {0} is already enabled for new benches and sites,Le serveur {0} est déjà activé pour les nouveaux benches et sites,
Servers are not provisioned yet.,Les serveurs ne sont pas encore provisionnés.,
Servers can be added only once,Les serveurs ne peuvent être ajoutés qu'une seule fois,
Servers feature is not yet enabled on your account,La fonctionnalité serveurs n'est pas encore activée sur votre compte,
Setting up communication info is only allowed for App Server,La configuration des informations de communication n'est autorisée que pour le serveur d'applications,
Setup,Configuration,
Setup stripe via Press Settings before using press.api.billing.get_stripe,Configurez Stripe via les paramètres Press avant d'utiliser press.api.billing.get_stripe,
Show,Afficher,
Site Creation Failed,Échec de la création du site,
Site deactivation should be used for physical backups only,La désactivation du site ne doit être utilisée que pour les sauvegardes physiques,
Site is under maintenance. Cannot Update,Le site est en maintenance. Mise à jour impossible,
Site not found in Frappe Cloud,Site introuvable dans Frappe Cloud,
Site with this subdomain already exists,Un site avec ce sous-domaine existe déjà,
Site {0} is currently on {1} plan and not {2},Le site {0} est actuellement sur le forfait {1} et non {2},
Site.subscription_plan must be a string,Site.subscription_plan doit être une chaîne de caractères,
Snapshot and server should be in same region.,Le snapshot et le serveur doivent être dans la même région.,
Snapshot creation per volume rate exceeded,Le taux de création de snapshots par volume a été dépassé,
Snapshot does not belong to this server,Le snapshot n'appartient pas à ce serveur,
Snapshot does not have a database server.,Le snapshot n'a pas de serveur de base de données.,
Snapshot is locked. Unlock the snapshot before deleting.,Le snapshot est verrouillé. Déverrouillez le snapshot avant de le supprimer.,
Snapshot status should be Pending or Completed.,Le statut du snapshot doit être En attente ou Terminé.,
Some builds failed skipping image pull!,Certains builds ont échoué en ignorant le téléchargement de l'image !,
"Sorry, this is not a SaaS site","Désolé, ce n'est pas un site SaaS",
"Sorry, you cannot login with this method. Please contact support for more details.","Désolé, vous ne pouvez pas vous connecter avec cette méthode. Veuillez contacter le support pour plus de détails.",
Space (GB),Espace (Go),
Space Free (GB),Espace libre (Go),
Space Used(%),Espace utilisé (%),
Specify CPU and/or memory requirements,Spécifiez les exigences en CPU et/ou en mémoire,
Staging plan not set in settings,Le forfait de staging n'est pas défini dans les paramètres,
Start Date and End Date are required to fetch the report.,La date de début et la date de fin sont requises pour générer le rapport.,
Start Date cannot be greater than End Date.,La date de début ne peut pas être supérieure à la date de fin.,
State,État,
Static IP is already associated with another instance.,L'IP statique est déjà associée à une autre instance.,
Status,Statut,
Stripe Invoice Creation Failed,Échec de la création de la facture Stripe,
"Subdomain contains invalid characters. Use lowercase characters, numbers and hyphens","Le sous-domaine contient des caractères invalides. Utilisez des lettres minuscules, des chiffres et des tirets",
Subdomain is required to create a site.,Un sous-domaine est requis pour créer un site.,
Subdomain too long. Use 32 or less characters,Sous-domaine trop long. Utilisez 32 caractères ou moins,
Subdomain too short. Use 5 or more characters,Sous-domaine trop court. Utilisez 5 caractères ou plus,
Submitted To Frappe,Soumis à Frappe,
Subscription is already active.,L'abonnement est déjà actif.,
Swap (GB),Swap (Go),
Swap Used(%),Swap utilisé (%),
Sync the VM before checking data disk for snapshot recovery,Synchronisez la VM avant de vérifier le disque de données pour la récupération par snapshot,
Target cluster must be different from current cluster.,Le cluster cible doit être différent du cluster actuel.,
Team,Équipe,
Team is mandatory for custom TLS certificates.,L'équipe est obligatoire pour les certificats TLS personnalisés.,
Team member already exists,Le membre d'équipe existe déjà,
Team not found in Frappe Cloud,Équipe introuvable dans Frappe Cloud,
Temporary server cannot be used for provisioning a database replica.,Un serveur temporaire ne peut pas être utilisé pour provisionner un réplica de base de données.,
The disk snapshot is unavailable because it has failed during the completion.,Le snapshot disque n'est pas disponible car il a échoué lors de la finalisation.,
The domain is not active currently. Please try again.,Le domaine n'est pas actif actuellement. Veuillez réessayer.,
The link using which you are trying to login is invalid or expired.,Le lien que vous utilisez pour vous connecter est invalide ou expiré.,
The link you are using is invalid or expired.,Le lien que vous utilisez est invalide ou expiré.,
The link you are using is invalid.,Le lien que vous utilisez est invalide.,
The plan must be a Saas App plan.,Le forfait doit être un forfait d'application SaaS.,
The request for the given app release was not rejected!,La demande pour cette version d'application n'a pas été rejetée !,
The secret seems invalid. Please verify your key secret and retry.,Le secret semble invalide. Veuillez vérifier votre clé secrète et réessayer.,
The server has replication setup. Binlogs cannot be purged forcefully.,Le serveur a une configuration de réplication. Les binlogs ne peuvent pas être purgés de force.,
The site has already been archived. Cannot move this site.,Le site a déjà été archivé. Impossible de déplacer ce site.,
"The site is not on a paid plan, please select the correct hosting","Le site n'est pas sur un forfait payant, veuillez sélectionner l'hébergement correct",
The update is probably underway. Please reload/refresh to get the latest status.,La mise à jour est probablement en cours. Veuillez recharger/actualiser pour obtenir le dernier statut.,
There are concurrent snapshot creation requests. Try again later.,Il y a des demandes de création de snapshot simultanées. Réessayez plus tard.,
There are no active sites on this server!,Il n'y a aucun site actif sur ce serveur !,
There is already a pending job for Add Database Index. Please wait until finished.,Une tâche en attente existe déjà pour l'ajout d'index de base de données. Veuillez patienter jusqu'à la fin.,
This feature is disabled,Cette fonctionnalité est désactivée,
This feature is only available for AWS EC2,Cette fonctionnalité n'est disponible que pour AWS EC2,
This feature is only available for beta testers,Cette fonctionnalité n'est disponible que pour les testeurs bêta,
This method is disabled,Cette méthode est désactivée,
This method is only meant for developer mode,Cette méthode est réservée au mode développeur,
Time,Heure,
Timestamp,Horodatage,
Token not found in payment response,Jeton introuvable dans la réponse de paiement,
Too many pending backups,Trop de sauvegardes en attente,
Transaction Error,Erreur de transaction,
Transaction ID,ID de transaction,
Transaction type is not set. Please set a transaction type and retry,Le type de transaction n'est pas défini. Veuillez définir un type de transaction et réessayer,
Two-Factor Authentication Required,Authentification à deux facteurs requise,
UPI Autopay is only available for currency INR,Le paiement automatique UPI n'est disponible que pour la devise DZD,
Unable to connect to monitor server,Impossible de se connecter au serveur de monitoring,
Unable to fetch alerts from Alertmanager,Impossible de récupérer les alertes depuis Alertmanager,
Unable to fetch database name. Please try again.,Impossible de récupérer le nom de la base de données. Veuillez réessayer.,
Unable to fetch metrics,Impossible de récupérer les métriques,
Unable to redeploy this build!,Impossible de redéployer ce build !,
Unsubscribed,Désabonné,
Upstream,Upstream,
"Use App Cache cannot be set, BENCH_VERSION must be 5.22.1 or later","Impossible d'activer le cache d'application, BENCH_VERSION doit être 5.22.1 ou ultérieur",
User,Utilisateur,
User certificates can only be valid for a short duration,Les certificats utilisateur ne peuvent être valides que pour une courte durée,
User has already been invited recently. Please try again later.,L'utilisateur a déjà été invité récemment. Veuillez réessayer plus tard.,
User is disabled,L'utilisateur est désactivé,
User is not a member of the team,L'utilisateur n'est pas membre de l'équipe,
User {0} does not belong to {1},L'utilisateur {0} n'appartient pas à {1},
User {0} is not a member of the team,L'utilisateur {0} n'est pas membre de l'équipe,
Value of goods cannot be 0,La valeur des marchandises ne peut pas être 0,
